<?xml version="1.0"?>
<!DOCTYPE Report
[
<!ELEMENT Report (General ,(Doc|BPT)) >
<!ATTLIST Report ver CDATA #REQUIRED tmZone CDATA #REQUIRED>

<!ELEMENT General ( DocLocation ) >
<!ATTLIST General productName CDATA #REQUIRED productVer CDATA #REQUIRED os CDATA #REQUIRED host CDATA #REQUIRED qcserver CDATA #IMPLIED qcproject CDATA #IMPLIED SolManSolutionId CDATA #IMPLIED SolManProjectId CDATA #IMPLIED SolManTestPlanId CDATA #IMPLIED SolManTestPackageId CDATA #IMPLIED SolManUserInfoData CDATA #IMPLIED  >

<!ELEMENT BPT (DName,Res,DVer?,TSet?,TInst?,NodeArgs,AdditionalInfo*,Doc*) >
<!ATTLIST BPT rID ID #REQUIRED >

<!ELEMENT Doc (DName,ConfName?,Res,DVer?,TSet?,TInst?,RunType?,DT?,AdditionalInfo*,Step*,DIter*,Step*,Action*,Doc*,Summary?,TestMaintenanceSummary*,NodeArgs?) >
<!ATTLIST Doc rID ID #REQUIRED type (Test|BC|BPTWrapperTest|Flow|Group|Action) "Test" productName CDATA #REQUIRED BCIter CDATA #IMPLIED >

<!ELEMENT RunType ( #PCDATA )>
<!ATTLIST RunType fmStep (False|True) "False" batch (False|True) "False" upDesc (False|True) "False" upChk (False|True) "False" upAS (False|True) "False">

<!ELEMENT DName ( #PCDATA ) >

<!ELEMENT ConfName ( #PCDATA ) >

<!ELEMENT Res ( #PCDATA ) >

<!ELEMENT AdditionalInfo (AdditionalDataName,AdditionalDataValue ) >

<!ELEMENT AdditionalDataName ( #PCDATA ) >

<!ELEMENT AdditionalDataValue ( #PCDATA ) >

<!ELEMENT DVer ( #PCDATA ) >

<!ELEMENT TSet ( #PCDATA ) >

<!ELEMENT TInst ( #PCDATA ) >

<!ELEMENT DIter (Step*,Action+,Summary?,NodeArgs)>
<!ATTLIST DIter rID ID #REQUIRED iterID CDATA #REQUIRED>

<!ELEMENT DocLocation ( #PCDATA )>

<!ELEMENT Action (AName,AIter*,(Step|HtmlStep|Action)*, Summary,ActionMaintenanceSummary*, NodeArgs ) >
<!ATTLIST Action rID ID #REQUIRED>

<!ELEMENT AIter ((Step|HtmlStep|Action)*,DataMapping?, Summary?,NodeArgs) >
<!ATTLIST AIter rID ID #REQUIRED iterID CDATA #REQUIRED isCountable (False|True) "False" >

<!ELEMENT AName ( #PCDATA ) >

<!ELEMENT TestMaintenanceSummary (ActionMaintenanceSummary*) >
<!ATTLIST TestMaintenanceSummary ObjectsAdded CDATA #REQUIRED ObjectsUpdated CDATA #REQUIRED StepsUpdated CDATA #REQUIRED StepsComments CDATA #REQUIRED><!ELEMENT ActionMaintenanceSummary (ObjectChange* ) >
<!ATTLIST ActionMaintenanceSummary Action CDATA #REQUIRED Objects CDATA #REQUIRED Updated CDATA #REQUIRED LinesTotal CDATA #REQUIRED Added CDATA #REQUIRED LinesUpdated CDATA #REQUIRED>

<!ELEMENT ObjectChange  (Hierarchy, PropertyChangeList* ) >
<!ATTLIST ObjectChange Operation CDATA #IMPLIED OriginalRepository CDATA #IMPLIED>

<!ELEMENT PropertyChangeList (PropertyDef*) >

<!ELEMENT PropertyDef (OriginalValue, NewValue) >
<!ATTLIST PropertyDef PropName CDATA #REQUIRED OriginRegularExpression (True|False) "False" NewRegularExpression (True|False) "False" AddedProperty (True|False) "False" >

<!ELEMENT OriginalValue ( #PCDATA )>

<!ELEMENT NewValue ( #PCDATA )>

<!ELEMENT Hierarchy  (ObjectName, Hierarchy*) >
<!ATTLIST Hierarchy MicClass CDATA #REQUIRED>

<!ELEMENT ObjectName  ( #PCDATA ) >

<!ELEMENT Step (Obj,Details,Time,TimeTick* ,(Step|HtmlStep|Doc)*, DataMapping?, NodeArgs) >
<!ATTLIST Step rID ID #REQUIRED retval CDATA #IMPLIED>

<!ELEMENT HtmlStep (HTML,TimeTick*,(Step|HtmlStep|Doc)*,NodeArgs) >
<!ATTLIST HtmlStep rID ID #REQUIRED >

<!ELEMENT Obj ( #PCDATA ) >
<!ATTLIST Obj plainTxt (False|True) "True">

<!ELEMENT Details ( #PCDATA ) >
<!ATTLIST Details plainTxt (False|True) "True">

<!ELEMENT Time ( #PCDATA ) >

<!ELEMENT HTML ( #PCDATA ) >

<!ELEMENT Disp ( #PCDATA ) >

<!ELEMENT TimeTick ( #PCDATA ) >

<!ELEMENT DataMapping ( DataMappedItem* )>
<!ELEMENT DataMappedItem EMPTY >
<!ATTLIST DataMappedItem dsName CDATA #REQUIRED >
<!ATTLIST DataMappedItem rowId CDATA #REQUIRED >

<!ELEMENT NodeArgs (Disp,TopPane?,BtmPane?,ExtendedInfo? )>
<!ATTLIST NodeArgs eType CDATA #REQUIRED icon CDATA #REQUIRED nRep CDATA #REQUIRED UserNote CDATA #IMPLIED filter (False|True) "True">
<!ATTLIST NodeArgs status (Passed|Failed|Done|Warning|Information) "Done">
<!ATTLIST NodeArgs iconSel CDATA #IMPLIED nType CDATA #IMPLIED MovieMarker CDATA "">
<!ATTLIST NodeArgs Source CDATA #IMPLIED SourceLine CDATA #IMPLIED StepFlowItemKey CDATA #IMPLIED >

<!ELEMENT TopPane (Path)>

<!ELEMENT BtmPane ( (Path|WR)?,ASHilite?)>
<!ATTLIST BtmPane vType CDATA "HTML">

<!ELEMENT Path ( #PCDATA ) >

<!ELEMENT ASHilite ( #PCDATA ) >

<!ELEMENT WR ( #PCDATA ) >

<!ELEMENT ExtendedInfo ( StepData ) >

<!ATTLIST ExtendedInfo StepType CDATA #REQUIRED>
<!ELEMENT DT (NodeArgs) >
<!ATTLIST DT rID ID #REQUIRED>

<!ELEMENT Summary (Param*)>
<!ATTLIST Summary sTime CDATA #IMPLIED eTime CDATA #IMPLIED passed CDATA #IMPLIED failed CDATA #IMPLIED warnings CDATA #IMPLIED retval CDATA #IMPLIED stopped (False|True) "False" >

<!ELEMENT Param (ParamName,ParamVal)+ >
<!ATTLIST Param paramInOut (In|Out) "In">

<!ELEMENT ParamName ( #PCDATA ) >

<!ELEMENT ParamVal ( #PCDATA ) >

]
>
<Report ver="2.0" tmZone="India Standard Time">
<General productName="Micro Focus UFT One" productVer="2021" os="Windows 10" host="vm001"><DocLocation><![CDATA[C:\Users\sfjbs\Desktop\UFT\Framework\DataDrivenFramework\Driver\Driver]]></DocLocation></General>
<Doc rID="T1"   productName= "Micro Focus UFT One"  >
<DName><![CDATA[Driver]]></DName>
<Res><![CDATA[Res33]]></Res>
<DT rID="T2">
<NodeArgs eType="Table" icon="2" nRep="4" filter="False" >
<Disp><![CDATA[Run-Time Data Table]]></Disp>
<BtmPane vType="Table" >
<Path><![CDATA[Default.xlsx]]></Path>
</BtmPane>
</NodeArgs>
</DT>
<DIter rID="T3" iterID="1" >
<Action rID="T4">
<AName><![CDATA[Action1]]></AName>
<Step rID="T5">
<Obj plainTxt="False" ><![CDATA[tr1]]></Obj>
<Details plainTxt="False" ><![CDATA[Transaction "tr1" started.]]></Details>
<Time><![CDATA[4/3/2022 - 14:49:40]]></Time>
<TimeTick>1648977580</TimeTick>
<NodeArgs eType="Transaction" icon="5" nRep="8" nType="Start Transaction" Source="Action1" SourceLine="3" >
<Disp><![CDATA[tr1]]></Disp>
</NodeArgs>
</Step>
<Step rID="T6">
<Obj plainTxt="False" ><![CDATA[SystemUtil]]></Obj>
<Details plainTxt="False" ><![CDATA[SystemUtil]]></Details>
<Time><![CDATA[4/3/2022 - 14:49:55]]></Time>
<TimeTick>1648977595</TimeTick>
<Step rID="T7">
<Obj plainTxt="False" ><![CDATA[Run "C:\Program Files (x86)\Micro Focus\UFT One\samples\Flights Application\FlightsGUI.exe",1]]></Obj>
<Details plainTxt="False" ><![CDATA[Run "C:\Program Files (x86)\Micro Focus\UFT One\samples\Flights Application\FlightsGUI.exe",1]]></Details>
<Time><![CDATA[4/3/2022 - 14:49:55]]></Time>
<TimeTick>1648977595</TimeTick>
<NodeArgs eType="Replay" icon="6" nRep="12" status="Passed" >
<Disp><![CDATA[Run "C:\Program Files (x86)\Micro Focus\UFT One\samples\Flights Application\FlightsGUI.exe",1]]></Disp>
</NodeArgs>
</Step>
<NodeArgs eType="Replay" icon="6" nRep="11" status="Passed" >
<Disp><![CDATA[SystemUtil]]></Disp>
</NodeArgs>
</Step>
<Step rID="T8">
<Obj plainTxt="False" ><![CDATA[Micro Focus MyFlight Sample]]></Obj>
<Details plainTxt="False" ><![CDATA[WpfWindow]]></Details>
<Time><![CDATA[4/3/2022 - 14:50:01]]></Time>
<TimeTick>1648977601</TimeTick>
<Step rID="T9">
<Obj plainTxt="False" ><![CDATA[agentName.Set]]></Obj>
<Details plainTxt="False" ><![CDATA["john"]]></Details>
<Time><![CDATA[4/3/2022 - 14:50:01]]></Time>
<TimeTick>1648977601</TimeTick>
<NodeArgs eType="Replay" icon="8" nRep="15" >
<Disp><![CDATA[agentName.Set]]></Disp>
</NodeArgs>
</Step>
<Step rID="T10">
<Obj plainTxt="False" ><![CDATA[password.Set]]></Obj>
<Details plainTxt="False" ><![CDATA["hp"]]></Details>
<Time><![CDATA[4/3/2022 - 14:50:01]]></Time>
<TimeTick>1648977601</TimeTick>
<NodeArgs eType="Replay" icon="8" nRep="17" >
<Disp><![CDATA[password.Set]]></Disp>
</NodeArgs>
</Step>
<Step rID="T11">
<Obj plainTxt="False" ><![CDATA[OK.Click]]></Obj>
<Details plainTxt="False" ><![CDATA[]]></Details>
<Time><![CDATA[4/3/2022 - 14:50:01]]></Time>
<TimeTick>1648977601</TimeTick>
<NodeArgs eType="Replay" icon="9" nRep="19" >
<Disp><![CDATA[OK.Click]]></Disp>
</NodeArgs>
</Step>
<Step rID="T12">
<Obj plainTxt="False" ><![CDATA[Micro Focus MyFlight Sample.Exist]]></Obj>
<Details plainTxt="False" ><![CDATA["Object exists"]]></Details>
<Time><![CDATA[4/3/2022 - 14:50:02]]></Time>
<TimeTick>1648977602</TimeTick>
<NodeArgs eType="Replay" icon="7" nRep="20" >
<Disp><![CDATA[Micro Focus MyFlight Sample.Exist]]></Disp>
</NodeArgs>
</Step>
<NodeArgs eType="Context" icon="7" nRep="14" >
<Disp><![CDATA[Micro Focus MyFlight Sample]]></Disp>
</NodeArgs>
</Step>
<Step rID="T13">
<Obj ><![CDATA[Login]]></Obj>
<Details ><![CDATA[Login Successful]]></Details>
<Time><![CDATA[4/3/2022 - 14:50:02]]></Time>
<TimeTick>1648977602</TimeTick>
<NodeArgs eType="User" icon="10" nRep="21" status="Passed" >
<Disp><![CDATA[Login]]></Disp>
</NodeArgs>
</Step>
<Step rID="T14">
<Obj plainTxt="False" ><![CDATA[Micro Focus MyFlight Sample]]></Obj>
<Details plainTxt="False" ><![CDATA[WpfWindow]]></Details>
<Time><![CDATA[4/3/2022 - 14:50:03]]></Time>
<TimeTick>1648977603</TimeTick>
<Step rID="T15">
<Obj plainTxt="False" ><![CDATA[Micro Focus MyFlight Sample.Close]]></Obj>
<Details plainTxt="False" ><![CDATA[]]></Details>
<Time><![CDATA[4/3/2022 - 14:50:03]]></Time>
<TimeTick>1648977603</TimeTick>
<NodeArgs eType="Replay" icon="7" nRep="24" >
<Disp><![CDATA[Micro Focus MyFlight Sample.Close]]></Disp>
</NodeArgs>
</Step>
<Step rID="T16">
<Obj plainTxt="False" ><![CDATA[Micro Focus MyFlight Sample.Exist]]></Obj>
<Details plainTxt="False" ><![CDATA["Object does not exist"]]></Details>
<Time><![CDATA[4/3/2022 - 14:50:09]]></Time>
<TimeTick>1648977609</TimeTick>
<NodeArgs eType="Replay" icon="7" nRep="26" >
<Disp><![CDATA[Micro Focus MyFlight Sample.Exist]]></Disp>
</NodeArgs>
</Step>
<NodeArgs eType="Context" icon="7" nRep="23" >
<Disp><![CDATA[Micro Focus MyFlight Sample]]></Disp>
</NodeArgs>
</Step>
<Step rID="T17">
<Obj ><![CDATA[closeapp]]></Obj>
<Details ><![CDATA[closeapp Successful]]></Details>
<Time><![CDATA[4/3/2022 - 14:50:09]]></Time>
<TimeTick>1648977609</TimeTick>
<NodeArgs eType="User" icon="10" nRep="27" status="Passed" >
<Disp><![CDATA[closeapp]]></Disp>
</NodeArgs>
</Step>
<Step rID="T18">
<Obj plainTxt="False" ><![CDATA[SystemUtil]]></Obj>
<Details plainTxt="False" ><![CDATA[SystemUtil]]></Details>
<Time><![CDATA[4/3/2022 - 14:50:10]]></Time>
<TimeTick>1648977610</TimeTick>
<Step rID="T19">
<Obj plainTxt="False" ><![CDATA[Run "C:\Program Files (x86)\Micro Focus\UFT One\samples\Flights Application\FlightsGUI.exe",1]]></Obj>
<Details plainTxt="False" ><![CDATA[Run "C:\Program Files (x86)\Micro Focus\UFT One\samples\Flights Application\FlightsGUI.exe",1]]></Details>
<Time><![CDATA[4/3/2022 - 14:50:10]]></Time>
<TimeTick>1648977610</TimeTick>
<NodeArgs eType="Replay" icon="6" nRep="31" status="Passed" >
<Disp><![CDATA[Run "C:\Program Files (x86)\Micro Focus\UFT One\samples\Flights Application\FlightsGUI.exe",1]]></Disp>
</NodeArgs>
</Step>
<NodeArgs eType="Replay" icon="6" nRep="30" status="Passed" >
<Disp><![CDATA[SystemUtil]]></Disp>
</NodeArgs>
</Step>
<Step rID="T20">
<Obj plainTxt="False" ><![CDATA[Micro Focus MyFlight Sample]]></Obj>
<Details plainTxt="False" ><![CDATA[WpfWindow]]></Details>
<Time><![CDATA[4/3/2022 - 14:50:16]]></Time>
<TimeTick>1648977616</TimeTick>
<Step rID="T21">
<Obj plainTxt="False" ><![CDATA[agentName.Set]]></Obj>
<Details plainTxt="False" ><![CDATA["john"]]></Details>
<Time><![CDATA[4/3/2022 - 14:50:16]]></Time>
<TimeTick>1648977616</TimeTick>
<NodeArgs eType="Replay" icon="8" nRep="34" >
<Disp><![CDATA[agentName.Set]]></Disp>
</NodeArgs>
</Step>
<Step rID="T22">
<Obj plainTxt="False" ><![CDATA[password.Set]]></Obj>
<Details plainTxt="False" ><![CDATA["hp"]]></Details>
<Time><![CDATA[4/3/2022 - 14:50:16]]></Time>
<TimeTick>1648977616</TimeTick>
<NodeArgs eType="Replay" icon="8" nRep="36" >
<Disp><![CDATA[password.Set]]></Disp>
</NodeArgs>
</Step>
<Step rID="T23">
<Obj plainTxt="False" ><![CDATA[OK.Click]]></Obj>
<Details plainTxt="False" ><![CDATA[]]></Details>
<Time><![CDATA[4/3/2022 - 14:50:16]]></Time>
<TimeTick>1648977616</TimeTick>
<NodeArgs eType="Replay" icon="9" nRep="38" >
<Disp><![CDATA[OK.Click]]></Disp>
</NodeArgs>
</Step>
<Step rID="T24">
<Obj plainTxt="False" ><![CDATA[Micro Focus MyFlight Sample.Exist]]></Obj>
<Details plainTxt="False" ><![CDATA["Object exists"]]></Details>
<Time><![CDATA[4/3/2022 - 14:50:17]]></Time>
<TimeTick>1648977617</TimeTick>
<NodeArgs eType="Replay" icon="7" nRep="39" >
<Disp><![CDATA[Micro Focus MyFlight Sample.Exist]]></Disp>
</NodeArgs>
</Step>
<NodeArgs eType="Context" icon="7" nRep="33" >
<Disp><![CDATA[Micro Focus MyFlight Sample]]></Disp>
</NodeArgs>
</Step>
<Step rID="T25">
<Obj ><![CDATA[Login]]></Obj>
<Details ><![CDATA[Login Successful]]></Details>
<Time><![CDATA[4/3/2022 - 14:50:17]]></Time>
<TimeTick>1648977617</TimeTick>
<NodeArgs eType="User" icon="10" nRep="40" status="Passed" >
<Disp><![CDATA[Login]]></Disp>
</NodeArgs>
</Step>
<Step rID="T26">
<Obj plainTxt="False" ><![CDATA[Micro Focus MyFlight Sample]]></Obj>
<Details plainTxt="False" ><![CDATA[WpfWindow]]></Details>
<Time><![CDATA[4/3/2022 - 14:50:18]]></Time>
<TimeTick>1648977618</TimeTick>
<Step rID="T27">
<Obj plainTxt="False" ><![CDATA[Micro Focus MyFlight Sample.Close]]></Obj>
<Details plainTxt="False" ><![CDATA[]]></Details>
<Time><![CDATA[4/3/2022 - 14:50:18]]></Time>
<TimeTick>1648977618</TimeTick>
<NodeArgs eType="Replay" icon="7" nRep="43" >
<Disp><![CDATA[Micro Focus MyFlight Sample.Close]]></Disp>
</NodeArgs>
</Step>
<Step rID="T28">
<Obj plainTxt="False" ><![CDATA[Micro Focus MyFlight Sample.Exist]]></Obj>
<Details plainTxt="False" ><![CDATA["Object does not exist"]]></Details>
<Time><![CDATA[4/3/2022 - 14:50:24]]></Time>
<TimeTick>1648977624</TimeTick>
<NodeArgs eType="Replay" icon="7" nRep="45" >
<Disp><![CDATA[Micro Focus MyFlight Sample.Exist]]></Disp>
</NodeArgs>
</Step>
<NodeArgs eType="Context" icon="7" nRep="42" >
<Disp><![CDATA[Micro Focus MyFlight Sample]]></Disp>
</NodeArgs>
</Step>
<Step rID="T29">
<Obj ><![CDATA[closeapp]]></Obj>
<Details ><![CDATA[closeapp Successful]]></Details>
<Time><![CDATA[4/3/2022 - 14:50:24]]></Time>
<TimeTick>1648977624</TimeTick>
<NodeArgs eType="User" icon="10" nRep="46" status="Passed" >
<Disp><![CDATA[closeapp]]></Disp>
</NodeArgs>
</Step>
<Step rID="T30">
<Obj plainTxt="False" ><![CDATA[SystemUtil]]></Obj>
<Details plainTxt="False" ><![CDATA[SystemUtil]]></Details>
<Time><![CDATA[4/3/2022 - 14:50:25]]></Time>
<TimeTick>1648977625</TimeTick>
<Step rID="T31">
<Obj plainTxt="False" ><![CDATA[Run "C:\Program Files (x86)\Micro Focus\UFT One\samples\Flights Application\FlightsGUI.exe",1]]></Obj>
<Details plainTxt="False" ><![CDATA[Run "C:\Program Files (x86)\Micro Focus\UFT One\samples\Flights Application\FlightsGUI.exe",1]]></Details>
<Time><![CDATA[4/3/2022 - 14:50:25]]></Time>
<TimeTick>1648977625</TimeTick>
<NodeArgs eType="Replay" icon="6" nRep="50" status="Passed" >
<Disp><![CDATA[Run "C:\Program Files (x86)\Micro Focus\UFT One\samples\Flights Application\FlightsGUI.exe",1]]></Disp>
</NodeArgs>
</Step>
<NodeArgs eType="Replay" icon="6" nRep="49" status="Passed" >
<Disp><![CDATA[SystemUtil]]></Disp>
</NodeArgs>
</Step>
<Step rID="T32">
<Obj plainTxt="False" ><![CDATA[Micro Focus MyFlight Sample]]></Obj>
<Details plainTxt="False" ><![CDATA[WpfWindow]]></Details>
<Time><![CDATA[4/3/2022 - 14:50:31]]></Time>
<TimeTick>1648977631</TimeTick>
<Step rID="T33">
<Obj plainTxt="False" ><![CDATA[agentName.Set]]></Obj>
<Details plainTxt="False" ><![CDATA["john"]]></Details>
<Time><![CDATA[4/3/2022 - 14:50:31]]></Time>
<TimeTick>1648977631</TimeTick>
<NodeArgs eType="Replay" icon="8" nRep="53" >
<Disp><![CDATA[agentName.Set]]></Disp>
</NodeArgs>
</Step>
<Step rID="T34">
<Obj plainTxt="False" ><![CDATA[password.Set]]></Obj>
<Details plainTxt="False" ><![CDATA["hp"]]></Details>
<Time><![CDATA[4/3/2022 - 14:50:31]]></Time>
<TimeTick>1648977631</TimeTick>
<NodeArgs eType="Replay" icon="8" nRep="55" >
<Disp><![CDATA[password.Set]]></Disp>
</NodeArgs>
</Step>
<Step rID="T35">
<Obj plainTxt="False" ><![CDATA[OK.Click]]></Obj>
<Details plainTxt="False" ><![CDATA[]]></Details>
<Time><![CDATA[4/3/2022 - 14:50:31]]></Time>
<TimeTick>1648977631</TimeTick>
<NodeArgs eType="Replay" icon="9" nRep="57" >
<Disp><![CDATA[OK.Click]]></Disp>
</NodeArgs>
</Step>
<Step rID="T36">
<Obj plainTxt="False" ><![CDATA[Micro Focus MyFlight Sample.Exist]]></Obj>
<Details plainTxt="False" ><![CDATA["Object exists"]]></Details>
<Time><![CDATA[4/3/2022 - 14:50:32]]></Time>
<TimeTick>1648977632</TimeTick>
<NodeArgs eType="Replay" icon="7" nRep="58" >
<Disp><![CDATA[Micro Focus MyFlight Sample.Exist]]></Disp>
</NodeArgs>
</Step>
<NodeArgs eType="Context" icon="7" nRep="52" >
<Disp><![CDATA[Micro Focus MyFlight Sample]]></Disp>
</NodeArgs>
</Step>
<Step rID="T37">
<Obj ><![CDATA[Login]]></Obj>
<Details ><![CDATA[Login Successful]]></Details>
<Time><![CDATA[4/3/2022 - 14:50:32]]></Time>
<TimeTick>1648977632</TimeTick>
<NodeArgs eType="User" icon="10" nRep="59" status="Passed" >
<Disp><![CDATA[Login]]></Disp>
</NodeArgs>
</Step>
<Step rID="T38">
<Obj plainTxt="False" ><![CDATA[Micro Focus MyFlight Sample]]></Obj>
<Details plainTxt="False" ><![CDATA[WpfWindow]]></Details>
<Time><![CDATA[4/3/2022 - 14:50:33]]></Time>
<TimeTick>1648977633</TimeTick>
<Step rID="T39">
<Obj plainTxt="False" ><![CDATA[Micro Focus MyFlight Sample.Close]]></Obj>
<Details plainTxt="False" ><![CDATA[]]></Details>
<Time><![CDATA[4/3/2022 - 14:50:33]]></Time>
<TimeTick>1648977633</TimeTick>
<NodeArgs eType="Replay" icon="7" nRep="62" >
<Disp><![CDATA[Micro Focus MyFlight Sample.Close]]></Disp>
</NodeArgs>
</Step>
<Step rID="T40">
<Obj plainTxt="False" ><![CDATA[Micro Focus MyFlight Sample.Exist]]></Obj>
<Details plainTxt="False" ><![CDATA["Object does not exist"]]></Details>
<Time><![CDATA[4/3/2022 - 14:50:39]]></Time>
<TimeTick>1648977639</TimeTick>
<NodeArgs eType="Replay" icon="7" nRep="64" >
<Disp><![CDATA[Micro Focus MyFlight Sample.Exist]]></Disp>
</NodeArgs>
</Step>
<NodeArgs eType="Context" icon="7" nRep="61" >
<Disp><![CDATA[Micro Focus MyFlight Sample]]></Disp>
</NodeArgs>
</Step>
<Step rID="T41">
<Obj ><![CDATA[closeapp]]></Obj>
<Details ><![CDATA[closeapp Successful]]></Details>
<Time><![CDATA[4/3/2022 - 14:50:39]]></Time>
<TimeTick>1648977639</TimeTick>
<NodeArgs eType="User" icon="10" nRep="65" status="Passed" >
<Disp><![CDATA[closeapp]]></Disp>
</NodeArgs>
</Step>
<Step rID="T42">
<Obj plainTxt="False" ><![CDATA[SystemUtil]]></Obj>
<Details plainTxt="False" ><![CDATA[SystemUtil]]></Details>
<Time><![CDATA[4/3/2022 - 14:50:40]]></Time>
<TimeTick>1648977640</TimeTick>
<Step rID="T43">
<Obj plainTxt="False" ><![CDATA[Run "C:\Program Files (x86)\Micro Focus\UFT One\samples\Flights Application\FlightsGUI.exe",1]]></Obj>
<Details plainTxt="False" ><![CDATA[Run "C:\Program Files (x86)\Micro Focus\UFT One\samples\Flights Application\FlightsGUI.exe",1]]></Details>
<Time><![CDATA[4/3/2022 - 14:50:40]]></Time>
<TimeTick>1648977640</TimeTick>
<NodeArgs eType="Replay" icon="6" nRep="69" status="Passed" >
<Disp><![CDATA[Run "C:\Program Files (x86)\Micro Focus\UFT One\samples\Flights Application\FlightsGUI.exe",1]]></Disp>
</NodeArgs>
</Step>
<NodeArgs eType="Replay" icon="6" nRep="68" status="Passed" >
<Disp><![CDATA[SystemUtil]]></Disp>
</NodeArgs>
</Step>
<Step rID="T44">
<Obj plainTxt="False" ><![CDATA[Micro Focus MyFlight Sample]]></Obj>
<Details plainTxt="False" ><![CDATA[WpfWindow]]></Details>
<Time><![CDATA[4/3/2022 - 14:50:46]]></Time>
<TimeTick>1648977646</TimeTick>
<Step rID="T45">
<Obj plainTxt="False" ><![CDATA[agentName.Set]]></Obj>
<Details plainTxt="False" ><![CDATA["john"]]></Details>
<Time><![CDATA[4/3/2022 - 14:50:46]]></Time>
<TimeTick>1648977646</TimeTick>
<NodeArgs eType="Replay" icon="8" nRep="72" >
<Disp><![CDATA[agentName.Set]]></Disp>
</NodeArgs>
</Step>
<Step rID="T46">
<Obj plainTxt="False" ><![CDATA[password.Set]]></Obj>
<Details plainTxt="False" ><![CDATA["hp"]]></Details>
<Time><![CDATA[4/3/2022 - 14:50:46]]></Time>
<TimeTick>1648977646</TimeTick>
<NodeArgs eType="Replay" icon="8" nRep="74" >
<Disp><![CDATA[password.Set]]></Disp>
</NodeArgs>
</Step>
<Step rID="T47">
<Obj plainTxt="False" ><![CDATA[OK.Click]]></Obj>
<Details plainTxt="False" ><![CDATA[]]></Details>
<Time><![CDATA[4/3/2022 - 14:50:46]]></Time>
<TimeTick>1648977646</TimeTick>
<NodeArgs eType="Replay" icon="9" nRep="76" >
<Disp><![CDATA[OK.Click]]></Disp>
</NodeArgs>
</Step>
<Step rID="T48">
<Obj plainTxt="False" ><![CDATA[Micro Focus MyFlight Sample.Exist]]></Obj>
<Details plainTxt="False" ><![CDATA["Object exists"]]></Details>
<Time><![CDATA[4/3/2022 - 14:50:47]]></Time>
<TimeTick>1648977647</TimeTick>
<NodeArgs eType="Replay" icon="7" nRep="77" >
<Disp><![CDATA[Micro Focus MyFlight Sample.Exist]]></Disp>
</NodeArgs>
</Step>
<NodeArgs eType="Context" icon="7" nRep="71" >
<Disp><![CDATA[Micro Focus MyFlight Sample]]></Disp>
</NodeArgs>
</Step>
<Step rID="T49">
<Obj ><![CDATA[Login]]></Obj>
<Details ><![CDATA[Login Successful]]></Details>
<Time><![CDATA[4/3/2022 - 14:50:47]]></Time>
<TimeTick>1648977647</TimeTick>
<NodeArgs eType="User" icon="10" nRep="78" status="Passed" >
<Disp><![CDATA[Login]]></Disp>
</NodeArgs>
</Step>
<Step rID="T50">
<Obj plainTxt="False" ><![CDATA[Micro Focus MyFlight Sample]]></Obj>
<Details plainTxt="False" ><![CDATA[WpfWindow]]></Details>
<Time><![CDATA[4/3/2022 - 14:50:48]]></Time>
<TimeTick>1648977648</TimeTick>
<Step rID="T51">
<Obj plainTxt="False" ><![CDATA[Micro Focus MyFlight Sample.Close]]></Obj>
<Details plainTxt="False" ><![CDATA[]]></Details>
<Time><![CDATA[4/3/2022 - 14:50:48]]></Time>
<TimeTick>1648977648</TimeTick>
<NodeArgs eType="Replay" icon="7" nRep="81" >
<Disp><![CDATA[Micro Focus MyFlight Sample.Close]]></Disp>
</NodeArgs>
</Step>
<Step rID="T52">
<Obj plainTxt="False" ><![CDATA[Micro Focus MyFlight Sample.Exist]]></Obj>
<Details plainTxt="False" ><![CDATA["Object does not exist"]]></Details>
<Time><![CDATA[4/3/2022 - 14:50:54]]></Time>
<TimeTick>1648977654</TimeTick>
<NodeArgs eType="Replay" icon="7" nRep="83" >
<Disp><![CDATA[Micro Focus MyFlight Sample.Exist]]></Disp>
</NodeArgs>
</Step>
<NodeArgs eType="Context" icon="7" nRep="80" >
<Disp><![CDATA[Micro Focus MyFlight Sample]]></Disp>
</NodeArgs>
</Step>
<Step rID="T53">
<Obj ><![CDATA[closeapp]]></Obj>
<Details ><![CDATA[closeapp Successful]]></Details>
<Time><![CDATA[4/3/2022 - 14:50:54]]></Time>
<TimeTick>1648977654</TimeTick>
<NodeArgs eType="User" icon="10" nRep="84" status="Passed" >
<Disp><![CDATA[closeapp]]></Disp>
</NodeArgs>
</Step>
<Step rID="T54">
<Obj plainTxt="False" ><![CDATA[SystemUtil]]></Obj>
<Details plainTxt="False" ><![CDATA[SystemUtil]]></Details>
<Time><![CDATA[4/3/2022 - 14:50:55]]></Time>
<TimeTick>1648977655</TimeTick>
<Step rID="T55">
<Obj plainTxt="False" ><![CDATA[Run "C:\Program Files (x86)\Micro Focus\UFT One\samples\Flights Application\FlightsGUI.exe",1]]></Obj>
<Details plainTxt="False" ><![CDATA[Run "C:\Program Files (x86)\Micro Focus\UFT One\samples\Flights Application\FlightsGUI.exe",1]]></Details>
<Time><![CDATA[4/3/2022 - 14:50:55]]></Time>
<TimeTick>1648977655</TimeTick>
<NodeArgs eType="Replay" icon="6" nRep="88" status="Passed" >
<Disp><![CDATA[Run "C:\Program Files (x86)\Micro Focus\UFT One\samples\Flights Application\FlightsGUI.exe",1]]></Disp>
</NodeArgs>
</Step>
<NodeArgs eType="Replay" icon="6" nRep="87" status="Passed" >
<Disp><![CDATA[SystemUtil]]></Disp>
</NodeArgs>
</Step>
<Step rID="T56">
<Obj plainTxt="False" ><![CDATA[Micro Focus MyFlight Sample]]></Obj>
<Details plainTxt="False" ><![CDATA[WpfWindow]]></Details>
<Time><![CDATA[4/3/2022 - 14:51:01]]></Time>
<TimeTick>1648977661</TimeTick>
<Step rID="T57">
<Obj plainTxt="False" ><![CDATA[agentName.Set]]></Obj>
<Details plainTxt="False" ><![CDATA["john"]]></Details>
<Time><![CDATA[4/3/2022 - 14:51:01]]></Time>
<TimeTick>1648977661</TimeTick>
<NodeArgs eType="Replay" icon="8" nRep="91" >
<Disp><![CDATA[agentName.Set]]></Disp>
</NodeArgs>
</Step>
<Step rID="T58">
<Obj plainTxt="False" ><![CDATA[password.Set]]></Obj>
<Details plainTxt="False" ><![CDATA["hp"]]></Details>
<Time><![CDATA[4/3/2022 - 14:51:01]]></Time>
<TimeTick>1648977661</TimeTick>
<NodeArgs eType="Replay" icon="8" nRep="93" >
<Disp><![CDATA[password.Set]]></Disp>
</NodeArgs>
</Step>
<Step rID="T59">
<Obj plainTxt="False" ><![CDATA[OK.Click]]></Obj>
<Details plainTxt="False" ><![CDATA[]]></Details>
<Time><![CDATA[4/3/2022 - 14:51:01]]></Time>
<TimeTick>1648977661</TimeTick>
<NodeArgs eType="Replay" icon="9" nRep="95" >
<Disp><![CDATA[OK.Click]]></Disp>
</NodeArgs>
</Step>
<Step rID="T60">
<Obj plainTxt="False" ><![CDATA[Micro Focus MyFlight Sample.Exist]]></Obj>
<Details plainTxt="False" ><![CDATA["Object exists"]]></Details>
<Time><![CDATA[4/3/2022 - 14:51:01]]></Time>
<TimeTick>1648977661</TimeTick>
<NodeArgs eType="Replay" icon="7" nRep="96" >
<Disp><![CDATA[Micro Focus MyFlight Sample.Exist]]></Disp>
</NodeArgs>
</Step>
<NodeArgs eType="Context" icon="7" nRep="90" >
<Disp><![CDATA[Micro Focus MyFlight Sample]]></Disp>
</NodeArgs>
</Step>
<Step rID="T61">
<Obj ><![CDATA[Login]]></Obj>
<Details ><![CDATA[Login Successful]]></Details>
<Time><![CDATA[4/3/2022 - 14:51:01]]></Time>
<TimeTick>1648977661</TimeTick>
<NodeArgs eType="User" icon="10" nRep="97" status="Passed" >
<Disp><![CDATA[Login]]></Disp>
</NodeArgs>
</Step>
<Step rID="T62">
<Obj plainTxt="False" ><![CDATA[Micro Focus MyFlight Sample]]></Obj>
<Details plainTxt="False" ><![CDATA[WpfWindow]]></Details>
<Time><![CDATA[4/3/2022 - 14:51:03]]></Time>
<TimeTick>1648977663</TimeTick>
<Step rID="T63">
<Obj plainTxt="False" ><![CDATA[Micro Focus MyFlight Sample.Close]]></Obj>
<Details plainTxt="False" ><![CDATA[]]></Details>
<Time><![CDATA[4/3/2022 - 14:51:03]]></Time>
<TimeTick>1648977663</TimeTick>
<NodeArgs eType="Replay" icon="7" nRep="100" >
<Disp><![CDATA[Micro Focus MyFlight Sample.Close]]></Disp>
</NodeArgs>
</Step>
<Step rID="T64">
<Obj plainTxt="False" ><![CDATA[Micro Focus MyFlight Sample.Exist]]></Obj>
<Details plainTxt="False" ><![CDATA["Object does not exist"]]></Details>
<Time><![CDATA[4/3/2022 - 14:51:08]]></Time>
<TimeTick>1648977668</TimeTick>
<NodeArgs eType="Replay" icon="7" nRep="102" >
<Disp><![CDATA[Micro Focus MyFlight Sample.Exist]]></Disp>
</NodeArgs>
</Step>
<NodeArgs eType="Context" icon="7" nRep="99" >
<Disp><![CDATA[Micro Focus MyFlight Sample]]></Disp>
</NodeArgs>
</Step>
<Step rID="T65">
<Obj ><![CDATA[closeapp]]></Obj>
<Details ><![CDATA[closeapp Successful]]></Details>
<Time><![CDATA[4/3/2022 - 14:51:08]]></Time>
<TimeTick>1648977668</TimeTick>
<NodeArgs eType="User" icon="10" nRep="103" status="Passed" >
<Disp><![CDATA[closeapp]]></Disp>
</NodeArgs>
</Step>
<Step rID="T66">
<Obj plainTxt="False" ><![CDATA[tr1]]></Obj>
<Details plainTxt="False" ><![CDATA[Transaction "tr1" ended with "Pass" status (Total Duration: 89.9594 sec).]]></Details>
<Time><![CDATA[4/3/2022 - 14:51:10]]></Time>
<TimeTick>1648977670</TimeTick>
<NodeArgs eType="Transaction" icon="11" nRep="104" nType="End Transaction" Source="Action1" SourceLine="81" >
<Disp><![CDATA[tr1]]></Disp>
</NodeArgs>
</Step>
<Summary sTime="4/3/2022 - 14:49:40" eTime="4/3/2022 - 14:51:10" passed="15" failed="0" warnings="0" ></Summary>
<NodeArgs eType="StartAction" icon="4" nRep="7" status="Passed" >
<Disp><![CDATA[Action1 Summary]]></Disp>
</NodeArgs>
</Action>
<Action rID="T67">
<AName><![CDATA[Action2]]></AName>
<Summary sTime="4/3/2022 - 14:51:10" eTime="4/3/2022 - 14:51:10" passed="0" failed="0" warnings="0" ></Summary>
<NodeArgs eType="StartAction" icon="4" nRep="106" >
<Disp><![CDATA[Action2 Summary]]></Disp>
</NodeArgs>
</Action>
<Action rID="T68">
<AName><![CDATA[Action3]]></AName>
<Summary sTime="4/3/2022 - 14:51:11" eTime="4/3/2022 - 14:51:11" passed="0" failed="0" warnings="0" ></Summary>
<NodeArgs eType="StartAction" icon="4" nRep="108" >
<Disp><![CDATA[Action3 Summary]]></Disp>
</NodeArgs>
</Action>
<Action rID="T69">
<AName><![CDATA[Action4]]></AName>
<Summary sTime="4/3/2022 - 14:51:11" eTime="4/3/2022 - 14:51:11" passed="0" failed="0" warnings="0" ></Summary>
<NodeArgs eType="StartAction" icon="4" nRep="110" >
<Disp><![CDATA[Action4 Summary]]></Disp>
</NodeArgs>
</Action>
<NodeArgs eType="StartIteration" icon="3" nRep="6" status="Passed" >
<Disp><![CDATA[Driver Iteration 1 (Row 1)]]></Disp>
</NodeArgs>
</DIter>
<Summary sTime="4/3/2022 - 14:49:27" eTime="4/3/2022 - 14:51:11" passed="15" failed="0" warnings="0" ></Summary>
<NodeArgs eType="StartTest" icon="1" nRep="3" status="Passed" >
<Disp><![CDATA[Test Driver Summary]]></Disp>
</NodeArgs>
</Doc>
</Report>